{
	"$schema": "http://json-schema.org/schema#",
	"$id": "file:///Users/rs2668/Development/other/linked-art/json-validator/schema/",
	"title": "Visual Content Schema",
	"description": "_crm:E36\\_Visual\\_Item_\nThe visual content of a work.\nSee: [API](https://linked.art/api/1.0/endpoint/visual_work/) | [Model](https://linked.art/model/object/aboutness/#physical-object-and-visual-work)",
	"type": "object",
	"properties": {
		"@context": {"$ref": "core.json#/definitions/ContextStringOrArray"},
		"id": {"$ref": "core.json#/definitions/idProp"},				
		"type": {"allOf": [{"title": "General", "$ref": "core.json#/definitions/typeProp"}, 
			{"title": "Specific", "type": "string", "const": "VisualItem"}]},
		"_label": {"$ref": "core.json#/definitions/labelProp"},
		"identified_by": {"$ref": "core.json#/definitions/identified_byProp"},
		"classified_as": {"$ref": "core.json#/definitions/classified_asProp"},
		"referred_to_by": {"$ref": "core.json#/definitions/referred_to_byProp"},
		"equivalent": {"allOf": [{"title": "General", "$ref": "core.json#/definitions/equivalentProp"}, 
			{"title": "Specific", "description": "List of equivalent `VisualItem` entities", "type": "array", "items": {"$ref": "core.json#/definitions/VisualItemRef"}}]},
		"member_of": {"$ref": "core.json#/definitions/member_ofSetProp"},
		"subject_of": {"$ref": "core.json#/definitions/subject_ofProp"},
		"attributed_by": {"$ref": "core.json#/definitions/attributed_byRelProp"},
		"dimension": {"$ref": "core.json#/definitions/dimensionProp"},

		"part_of": {"title": "crm:P106i_forms_part_of", "description": "Another Visual Item which this Visual Item is part of", "$ref": "core.json#/definitions/VisualItemRef"},
		"digitally_shown_by": {"title": "la:digitally_carried_by", "description": "", "type": "array", "items": {"$ref": "core.json#/definitions/DigitalObjectRef"}},
		"shown_by": {"title": "crm:P128i_is_carried_by", "description": "", "type": "array", "items": {"$ref": "core.json#/definitions/HumanMadeObjectRef"}},
		"about": {"title": "crm:P129_is_about", "description": "The main topic(s) of the content", "type": "array", "items": {"$ref": "core.json#/definitions/AnyRef"}},
		"created_by": {"title": "crm:P94i_was_created_by", "$ref": "#/definitions/Creation"},
		"represents": {"title": "crm:P138_represents", "description": "An entity which is represented in this image content", "type": "array", "items": {"$ref": "core.json#/definitions/AnyRef"}},
		"represents_instance_of_type": {"title": "la:represents_instance_of_type", "description": "A Type of an entity, which is represented in this image content", "type": "array", "items": {"$ref": "core.json#/definitions/Concept"}},
		"used_for": {"title": "crm:P16i_was_used_for", "description": "", "type": "array", "items": {"$ref": "core.json#/definitions/Activity"}}

	},
	"definitions": {
		"Creation": {
			"title": "crm:E65_Creation",
			"description": "The creation / writing of the text",
			"type": "object",
			"properties": {
				"type": {"allOf": [{"title": "General", "$ref": "core.json#/definitions/typeProp"}, 
					{"title": "Specific", "type": "string", "const": "Creation"}]},
				"_label": {"$ref": "core.json#/definitions/labelProp"},
				"identified_by": {"$ref": "core.json#/definitions/identified_byProp"},
				"classified_as": {"$ref": "core.json#/definitions/classified_asProp"},
				"referred_to_by": {"$ref": "core.json#/definitions/referred_to_byProp"},
				"took_place_at": {"$ref": "core.json#/definitions/took_place_atProp"},
				"timespan": {"$ref": "core.json#/definitions/timespanProp"},
				"caused_by": {"$ref": "core.json#/definitions/caused_byProp"},
				"carried_out_by": {"$ref": "core.json#/definitions/carried_out_byProp"},
				"used_specific_object": {"$ref": "core.json#/definitions/used_specific_objectProp"},
				"influenced_by": {"$ref": "core.json#/definitions/influenced_byProp"},
				"technique": {"$ref": "core.json#/definitions/techniqueProp"},
				"part_of": {"title": "crm:P9i_forms_part_of", "description": "An identified event or activity which this creation is part of", "$ref": "core.json#/definitions/EventRefOrActivityRef"}
			}
		}
	},
	"required": ["@context", "id", "type", "_label"],
	"additionalProperties": false
}